{"type":"elemental4:theme","format_version":1,"version":2,"id":"elem4_dark","name":"Default Dark","author":"Dave Caruso","description":"The built in dark mode for Elemental 4.","styles":"./dark.css","icon":"./icon.png","colors":{"white":{"color":"#FFFFFF","saturationMultiplier":0,"lightnessMultiplier":0},"black":{"color":"#000000","saturationMultiplier":0,"lightnessMultiplier":0},"grey":{"color":"#7F7F7F","saturationMultiplier":0,"lightnessMultiplier":1.75},"brown":{"color":"#B58148","saturationMultiplier":0.5,"lightnessMultiplier":0.8},"red":{"color":"#E35454","saturationMultiplier":1,"lightnessMultiplier":0.8},"orange":{"color":"#E38454","saturationMultiplier":1,"lightnessMultiplier":0.8},"yellow":{"color":"#E3CB54","saturationMultiplier":1,"lightnessMultiplier":0.8},"yellow-green":{"color":"#B3E354","saturationMultiplier":1,"lightnessMultiplier":0.8},"green":{"color":"#54E360","saturationMultiplier":1,"lightnessMultiplier":0.8},"aqua":{"color":"#54E3B3","saturationMultiplier":1,"lightnessMultiplier":0.8},"blue":{"color":"#54b3e3","saturationMultiplier":1,"lightnessMultiplier":0.8},"dark-blue":{"color":"#5475e3","saturationMultiplier":1,"lightnessMultiplier":0.8},"purple":{"color":"#8654E3","saturationMultiplier":1,"lightnessMultiplier":0.8},"magenta":{"color":"#D054E3","saturationMultiplier":1,"lightnessMultiplier":0.8},"hot-pink":{"color":"#E354A2","saturationMultiplier":1,"lightnessMultiplier":0.8}}}